{
  "id": "claim-project-world",
  "statement": "The project presents a near-future Brooklyn storyworld combining hip-hop, anime, and supernatural horror.",
  "status": "qualified",
  "sourceIds": ["source-youtube-trailer"],
  "qualification": "The initial statement comes from submitted public materials and requires broader web verification."
}
